{
  "kind": "historical-offline-pipeline-sample",
  "source_url": "https://raw.githubusercontent.com/rfordatascience/tidytuesday/78474f0d3496a1f855deeceb63e250f494cbe938/data/2019/2019-05-14/nobel_winners.csv",
  "source_sha256": "4a82ce9250e0f7fea1fa1df63f8bf793b053f61e13acc7536b66f65342af616a",
  "source_repository_license": "CC0-1.0",
  "upstream_provenance": "Nobel Foundation laureates CSV via Kaggle; recorded in TidyTuesday source README",
  "upstream_license_independently_verified": false,
  "repository_sample_date": "2019-05-14",
  "max_prize_year": 2016,
  "current_status_verified": false,
  "sitelinks_verified": false,
  "portrait_licenses_verified": false,
  "rows": [
    {
      "id": "nobel-5",
      "name": "Pierre Curie",
      "birth_date": "1859-05-15",
      "death_date": "1906-04-19",
      "snapshot_status": "death-recorded",
      "current_status_verified": false,
      "prize_year": 1903,
      "prize_category": "Physics",
      "wikidata_id": null,
      "sitelinks_count": null,
      "portrait": null
    },
    {
      "id": "nobel-6",
      "name": "Marie Curie, née Sklodowska",
      "birth_date": "1867-11-07",
      "death_date": "1934-07-04",
      "snapshot_status": "death-recorded",
      "current_status_verified": false,
      "prize_year": 1903,
      "prize_category": "Physics",
      "wikidata_id": null,
      "sitelinks_count": null,
      "portrait": null
    },
    {
      "id": "nobel-470",
      "name": "Theodore Roosevelt",
      "birth_date": "1858-10-27",
      "death_date": "1919-01-06",
      "snapshot_status": "death-recorded",
      "current_status_verified": false,
      "prize_year": 1906,
      "prize_category": "Peace",
      "wikidata_id": null,
      "sitelinks_count": null,
      "portrait": null
    },
    {
      "id": "nobel-577",
      "name": "Rudyard Kipling",
      "birth_date": "1865-12-30",
      "death_date": "1936-01-18",
      "snapshot_status": "death-recorded",
      "current_status_verified": false,
      "prize_year": 1907,
      "prize_category": "Literature",
      "wikidata_id": null,
      "sitelinks_count": null,
      "portrait": null
    },
    {
      "id": "nobel-583",
      "name": "Rabindranath Tagore",
      "birth_date": "1861-05-07",
      "death_date": "1941-08-07",
      "snapshot_status": "death-recorded",
      "current_status_verified": false,
      "prize_year": 1913,
      "prize_category": "Literature",
      "wikidata_id": null,
      "sitelinks_count": null,
      "portrait": null
    },
    {
      "id": "nobel-23",
      "name": "Max Karl Ernst Ludwig Planck",
      "birth_date": "1858-04-23",
      "death_date": "1947-10-04",
      "snapshot_status": "death-recorded",
      "current_status_verified": false,
      "prize_year": 1918,
      "prize_category": "Physics",
      "wikidata_id": null,
      "sitelinks_count": null,
      "portrait": null
    },
    {
      "id": "nobel-483",
      "name": "Thomas Woodrow Wilson",
      "birth_date": "1856-12-28",
      "death_date": "1924-02-03",
      "snapshot_status": "death-recorded",
      "current_status_verified": false,
      "prize_year": 1919,
      "prize_category": "Peace",
      "wikidata_id": null,
      "sitelinks_count": null,
      "portrait": null
    },
    {
      "id": "nobel-26",
      "name": "Albert Einstein",
      "birth_date": "1879-03-14",
      "death_date": "1955-04-18",
      "snapshot_status": "death-recorded",
      "current_status_verified": false,
      "prize_year": 1921,
      "prize_category": "Physics",
      "wikidata_id": null,
      "sitelinks_count": null,
      "portrait": null
    },
    {
      "id": "nobel-27",
      "name": "Niels Henrik David Bohr",
      "birth_date": "1885-10-07",
      "death_date": "1962-11-18",
      "snapshot_status": "death-recorded",
      "current_status_verified": false,
      "prize_year": 1922,
      "prize_category": "Physics",
      "wikidata_id": null,
      "sitelinks_count": null,
      "portrait": null
    },
    {
      "id": "nobel-38",
      "name": "Werner Karl Heisenberg",
      "birth_date": "1901-12-05",
      "death_date": "1976-02-01",
      "snapshot_status": "death-recorded",
      "current_status_verified": false,
      "prize_year": 1932,
      "prize_category": "Physics",
      "wikidata_id": null,
      "sitelinks_count": null,
      "portrait": null
    },
    {
      "id": "nobel-39",
      "name": "Erwin Schrödinger",
      "birth_date": "1887-08-12",
      "death_date": "1961-01-04",
      "snapshot_status": "death-recorded",
      "current_status_verified": false,
      "prize_year": 1933,
      "prize_category": "Physics",
      "wikidata_id": null,
      "sitelinks_count": null,
      "portrait": null
    },
    {
      "id": "nobel-40",
      "name": "Paul Adrien Maurice Dirac",
      "birth_date": "1902-08-08",
      "death_date": "1984-10-20",
      "snapshot_status": "death-recorded",
      "current_status_verified": false,
      "prize_year": 1933,
      "prize_category": "Physics",
      "wikidata_id": null,
      "sitelinks_count": null,
      "portrait": null
    },
    {
      "id": "nobel-339",
      "name": "Sir Alexander Fleming",
      "birth_date": "1881-08-06",
      "death_date": "1955-03-11",
      "snapshot_status": "death-recorded",
      "current_status_verified": false,
      "prize_year": 1945,
      "prize_category": "Medicine",
      "wikidata_id": null,
      "sitelinks_count": null,
      "portrait": null
    },
    {
      "id": "nobel-617",
      "name": "Hermann Hesse",
      "birth_date": "1877-07-02",
      "death_date": "1962-08-09",
      "snapshot_status": "death-recorded",
      "current_status_verified": false,
      "prize_year": 1946,
      "prize_category": "Literature",
      "wikidata_id": null,
      "sitelinks_count": null,
      "portrait": null
    },
    {
      "id": "nobel-620",
      "name": "William Faulkner",
      "birth_date": "1897-09-25",
      "death_date": "1962-07-06",
      "snapshot_status": "death-recorded",
      "current_status_verified": false,
      "prize_year": 1949,
      "prize_category": "Literature",
      "wikidata_id": null,
      "sitelinks_count": null,
      "portrait": null
    },
    {
      "id": "nobel-621",
      "name": "Earl (Bertrand Arthur William) Russell",
      "birth_date": "1872-05-18",
      "death_date": "1970-02-02",
      "snapshot_status": "death-recorded",
      "current_status_verified": false,
      "prize_year": 1950,
      "prize_category": "Literature",
      "wikidata_id": null,
      "sitelinks_count": null,
      "portrait": null
    },
    {
      "id": "nobel-624",
      "name": "Sir Winston Leonard Spencer Churchill",
      "birth_date": "1874-11-30",
      "death_date": "1965-01-24",
      "snapshot_status": "death-recorded",
      "current_status_verified": false,
      "prize_year": 1953,
      "prize_category": "Literature",
      "wikidata_id": null,
      "sitelinks_count": null,
      "portrait": null
    },
    {
      "id": "nobel-625",
      "name": "Ernest Miller Hemingway",
      "birth_date": "1899-07-21",
      "death_date": "1961-07-02",
      "snapshot_status": "death-recorded",
      "current_status_verified": false,
      "prize_year": 1954,
      "prize_category": "Literature",
      "wikidata_id": null,
      "sitelinks_count": null,
      "portrait": null
    },
    {
      "id": "nobel-628",
      "name": "Albert Camus",
      "birth_date": "1913-11-07",
      "death_date": "1960-01-04",
      "snapshot_status": "death-recorded",
      "current_status_verified": false,
      "prize_year": 1957,
      "prize_category": "Literature",
      "wikidata_id": null,
      "sitelinks_count": null,
      "portrait": null
    },
    {
      "id": "nobel-634",
      "name": "John Steinbeck",
      "birth_date": "1902-02-27",
      "death_date": "1968-12-20",
      "snapshot_status": "death-recorded",
      "current_status_verified": false,
      "prize_year": 1962,
      "prize_category": "Literature",
      "wikidata_id": null,
      "sitelinks_count": null,
      "portrait": null
    },
    {
      "id": "nobel-373",
      "name": "James Dewey Watson",
      "birth_date": "1928-04-06",
      "death_date": null,
      "snapshot_status": "no-death-recorded",
      "current_status_verified": false,
      "prize_year": 1962,
      "prize_category": "Medicine",
      "wikidata_id": null,
      "sitelinks_count": null,
      "portrait": null
    },
    {
      "id": "nobel-637",
      "name": "Jean-Paul Sartre",
      "birth_date": "1905-06-21",
      "death_date": "1980-04-15",
      "snapshot_status": "death-recorded",
      "current_status_verified": false,
      "prize_year": 1964,
      "prize_category": "Literature",
      "wikidata_id": null,
      "sitelinks_count": null,
      "portrait": null
    },
    {
      "id": "nobel-524",
      "name": "Martin Luther King Jr.",
      "birth_date": "1929-01-15",
      "death_date": "1968-04-04",
      "snapshot_status": "death-recorded",
      "current_status_verified": false,
      "prize_year": 1964,
      "prize_category": "Peace",
      "wikidata_id": null,
      "sitelinks_count": null,
      "portrait": null
    },
    {
      "id": "nobel-86",
      "name": "Richard P. Feynman",
      "birth_date": "1918-05-11",
      "death_date": "1988-02-15",
      "snapshot_status": "death-recorded",
      "current_status_verified": false,
      "prize_year": 1965,
      "prize_category": "Physics",
      "wikidata_id": null,
      "sitelinks_count": null,
      "portrait": null
    },
    {
      "id": "nobel-937",
      "name": "Bob Dylan",
      "birth_date": "1941-05-24",
      "death_date": null,
      "snapshot_status": "no-death-recorded",
      "current_status_verified": false,
      "prize_year": 2016,
      "prize_category": "Literature",
      "wikidata_id": null,
      "sitelinks_count": null,
      "portrait": null
    },
    {
      "id": "nobel-552",
      "name": "Mikhail Sergeyevich Gorbachev",